{
  "season": "2026",
  "draft_id": "1356407594700242944",
  "type": "snake",
  "rounds": 14,
  "teams": 10,
  "my_slot": 6,
  "slots": {
    "5": "I Think I\u2019\u2019m Gonna Puka",
    "7": "Rice Cooker",
    "4": "Jockstrappers",
    "10": "Achane Magic",
    "6": "Substation Supremacy",
    "8": "Brown Tuddies Likely ",
    "2": "Bijan Mustard",
    "9": "Pitts and Giggles",
    "1": "Gibbs Me Liberty",
    "3": "Breece\u2019s Pieces"
  },
  "picks": [
    {
      "round": 1,
      "slot": 1,
      "pick_no": 1,
      "player": {
        "id": "9221",
        "name": "Jahmyr Gibbs",
        "pos": "RB",
        "team": "DET"
      },
      "adp": 1.0,
      "mine": false
    },
    {
      "round": 1,
      "slot": 2,
      "pick_no": 2,
      "player": {
        "id": "9509",
        "name": "Bijan Robinson",
        "pos": "RB",
        "team": "ATL"
      },
      "adp": 2.0,
      "mine": false
    },
    {
      "round": 1,
      "slot": 3,
      "pick_no": 3,
      "player": {
        "id": "7564",
        "name": "Ja'Marr Chase",
        "pos": "WR",
        "team": "CIN"
      },
      "adp": 11.0,
      "mine": false
    },
    {
      "round": 1,
      "slot": 4,
      "pick_no": 4,
      "player": {
        "id": "9488",
        "name": "Jaxon Smith-Njigba",
        "pos": "WR",
        "team": "SEA"
      },
      "adp": 6.0,
      "mine": false
    },
    {
      "round": 1,
      "slot": 5,
      "pick_no": 5,
      "player": {
        "id": "9493",
        "name": "Puka Nacua",
        "pos": "WR",
        "team": "LAR"
      },
      "adp": 3.0,
      "mine": false
    },
    {
      "round": 1,
      "slot": 6,
      "pick_no": 6,
      "player": {
        "id": "4034",
        "name": "Christian McCaffrey",
        "pos": "RB",
        "team": "SF"
      },
      "adp": 4.0,
      "mine": true
    },
    {
      "round": 1,
      "slot": 7,
      "pick_no": 7,
      "player": {
        "id": "8138",
        "name": "James Cook",
        "pos": "RB",
        "team": "BUF"
      },
      "adp": 5.0,
      "mine": false
    },
    {
      "round": 1,
      "slot": 8,
      "pick_no": 8,
      "player": {
        "id": "7547",
        "name": "Amon-Ra St. Brown",
        "pos": "WR",
        "team": "DET"
      },
      "adp": 10.0,
      "mine": false
    },
    {
      "round": 1,
      "slot": 9,
      "pick_no": 9,
      "player": {
        "id": "6813",
        "name": "Jonathan Taylor",
        "pos": "RB",
        "team": "IND"
      },
      "adp": 8.0,
      "mine": false
    },
    {
      "round": 1,
      "slot": 10,
      "pick_no": 10,
      "player": {
        "id": "9226",
        "name": "De'Von Achane",
        "pos": "RB",
        "team": "MIA"
      },
      "adp": 16.0,
      "mine": false
    },
    {
      "round": 2,
      "slot": 10,
      "pick_no": 11,
      "player": {
        "id": "4866",
        "name": "Saquon Barkley",
        "pos": "RB",
        "team": "PHI"
      },
      "adp": 17.0,
      "mine": false
    },
    {
      "round": 2,
      "slot": 9,
      "pick_no": 12,
      "player": {
        "id": "6786",
        "name": "CeeDee Lamb",
        "pos": "WR",
        "team": "DAL"
      },
      "adp": 7.0,
      "mine": false
    },
    {
      "round": 2,
      "slot": 8,
      "pick_no": 13,
      "player": {
        "id": "9224",
        "name": "Chase Brown",
        "pos": "RB",
        "team": "CIN"
      },
      "adp": 24.0,
      "mine": false
    },
    {
      "round": 2,
      "slot": 7,
      "pick_no": 14,
      "player": {
        "id": "8151",
        "name": "Kenneth Walker",
        "pos": "RB",
        "team": "KC"
      },
      "adp": 18.0,
      "mine": false
    },
    {
      "round": 2,
      "slot": 6,
      "pick_no": 15,
      "player": {
        "id": "6794",
        "name": "Justin Jefferson",
        "pos": "WR",
        "team": "MIN"
      },
      "adp": 9.0,
      "mine": true
    },
    {
      "round": 2,
      "slot": 5,
      "pick_no": 16,
      "player": {
        "id": "8130",
        "name": "Trey McBride",
        "pos": "TE",
        "team": "ARI"
      },
      "adp": 20.0,
      "mine": false
    },
    {
      "round": 2,
      "slot": 4,
      "pick_no": 17,
      "player": {
        "id": "12507",
        "name": "Omarion Hampton",
        "pos": "RB",
        "team": "LAC"
      },
      "adp": 44.0,
      "mine": false
    },
    {
      "round": 2,
      "slot": 3,
      "pick_no": 18,
      "player": {
        "id": "5850",
        "name": "Josh Jacobs",
        "pos": "RB",
        "team": "GB"
      },
      "adp": 999.0,
      "mine": false
    },
    {
      "round": 2,
      "slot": 2,
      "pick_no": 19,
      "player": {
        "id": "4984",
        "name": "Josh Allen",
        "pos": "QB",
        "team": "BUF"
      },
      "adp": 25.0,
      "mine": false
    },
    {
      "round": 2,
      "slot": 1,
      "pick_no": 20,
      "player": {
        "id": "3198",
        "name": "Derrick Henry",
        "pos": "RB",
        "team": "BAL"
      },
      "adp": 28.0,
      "mine": false
    },
    {
      "round": 3,
      "slot": 1,
      "pick_no": 21,
      "player": {
        "id": "8112",
        "name": "Drake London",
        "pos": "WR",
        "team": "ATL"
      },
      "adp": 36.0,
      "mine": false
    },
    {
      "round": 3,
      "slot": 2,
      "pick_no": 22,
      "player": {
        "id": "5859",
        "name": "A.J. Brown",
        "pos": "WR",
        "team": "NE"
      },
      "adp": null,
      "mine": false
    },
    {
      "round": 3,
      "slot": 3,
      "pick_no": 23,
      "player": {
        "id": "8155",
        "name": "Breece Hall",
        "pos": "RB",
        "team": "NYJ"
      },
      "adp": 39.0,
      "mine": false
    },
    {
      "round": 3,
      "slot": 4,
      "pick_no": 24,
      "player": {
        "id": "13287",
        "name": "Jeremiyah Love",
        "pos": "RB",
        "team": "ARI"
      },
      "adp": 63.0,
      "mine": false
    },
    {
      "round": 3,
      "slot": 5,
      "pick_no": 25,
      "player": {
        "id": "11604",
        "name": "Brock Bowers",
        "pos": "TE",
        "team": "LV"
      },
      "adp": 30.0,
      "mine": false
    },
    {
      "round": 3,
      "slot": 6,
      "pick_no": 26,
      "player": {
        "id": "11632",
        "name": "Malik Nabers",
        "pos": "WR",
        "team": "NYG"
      },
      "adp": 34.0,
      "mine": true
    },
    {
      "round": 3,
      "slot": 7,
      "pick_no": 27,
      "player": {
        "id": "12527",
        "name": "Ashton Jeanty",
        "pos": "RB",
        "team": "LV"
      },
      "adp": 29.0,
      "mine": false
    },
    {
      "round": 3,
      "slot": 8,
      "pick_no": 28,
      "player": {
        "id": "8150",
        "name": "Kyren Williams",
        "pos": "RB",
        "team": "LAR"
      },
      "adp": 15.0,
      "mine": false
    },
    {
      "round": 3,
      "slot": 9,
      "pick_no": 29,
      "player": {
        "id": "7569",
        "name": "Nico Collins",
        "pos": "WR",
        "team": "HOU"
      },
      "adp": 27.0,
      "mine": false
    },
    {
      "round": 3,
      "slot": 10,
      "pick_no": 30,
      "player": {
        "id": "4881",
        "name": "Lamar Jackson",
        "pos": "QB",
        "team": "BAL"
      },
      "adp": 43.0,
      "mine": false
    },
    {
      "round": 4,
      "slot": 10,
      "pick_no": 31,
      "player": {
        "id": "8144",
        "name": "Chris Olave",
        "pos": "WR",
        "team": "NO"
      },
      "adp": 19.0,
      "mine": false
    },
    {
      "round": 4,
      "slot": 9,
      "pick_no": 32,
      "player": {
        "id": "7588",
        "name": "Javonte Williams",
        "pos": "RB",
        "team": "DAL"
      },
      "adp": 12.0,
      "mine": false
    },
    {
      "round": 4,
      "slot": 8,
      "pick_no": 33,
      "player": {
        "id": "8137",
        "name": "George Pickens",
        "pos": "WR",
        "team": "DAL"
      },
      "adp": 14.0,
      "mine": false
    },
    {
      "round": 4,
      "slot": 7,
      "pick_no": 34,
      "player": {
        "id": "7525",
        "name": "DeVonta Smith",
        "pos": "WR",
        "team": "PHI"
      },
      "adp": 23.0,
      "mine": false
    },
    {
      "round": 4,
      "slot": 6,
      "pick_no": 35,
      "player": {
        "id": "12517",
        "name": "Colston Loveland",
        "pos": "TE",
        "team": "CHI"
      },
      "adp": 56.0,
      "mine": true
    },
    {
      "round": 4,
      "slot": 5,
      "pick_no": 36,
      "player": {
        "id": "12512",
        "name": "Quinshon Judkins",
        "pos": "RB",
        "team": "CLE"
      },
      "adp": 65.0,
      "mine": false
    },
    {
      "round": 4,
      "slot": 4,
      "pick_no": 37,
      "player": {
        "id": "12526",
        "name": "Tetairoa McMillan",
        "pos": "WR",
        "team": "CAR"
      },
      "adp": 26.0,
      "mine": false
    },
    {
      "round": 4,
      "slot": 3,
      "pick_no": 38,
      "player": {
        "id": "12518",
        "name": "Tyler Warren",
        "pos": "TE",
        "team": "IND"
      },
      "adp": 58.0,
      "mine": false
    },
    {
      "round": 4,
      "slot": 2,
      "pick_no": 39,
      "player": {
        "id": "12514",
        "name": "Emeka Egbuka",
        "pos": "WR",
        "team": "TB"
      },
      "adp": 87.0,
      "mine": false
    },
    {
      "round": 4,
      "slot": 1,
      "pick_no": 40,
      "player": {
        "id": "11564",
        "name": "Drake Maye",
        "pos": "QB",
        "team": "NE"
      },
      "adp": 72.0,
      "mine": false
    },
    {
      "round": 5,
      "slot": 1,
      "pick_no": 41,
      "player": {
        "id": "6801",
        "name": "Tee Higgins",
        "pos": "WR",
        "team": "CIN"
      },
      "adp": 35.0,
      "mine": false